problem_type,current_role,target_role,years_experience,industry,constraints,advice_summary,outcome,outcome_sentiment,has_outcome,salary_mentioned,location,post_id,subreddit,title,score,url,created_date,has_update,_error
career_switch,IT developer,sales,2.0,technology,"['rejections from companies', 'ghost jobs', 'interned for free', 'grinding Leetcode', 'negative comments']",The post suggests that letting go of the pressure to succeed in tech can lead to unexpected opportunities and greater happiness.,The author received a job offer for a sales position with proper mentorship.,positive,True,False,,1mcop22,cscareerquestions,I quit CS and I’m 300% happier.,4530,https://reddit.com/r/cscareerquestions/comments/1mcop22/i_quit_cs_and_im_300_happier/,2025-07-29,True,
job_search,Senior Fullstack Engineer,Systems Engineer,10.0,tech,"['laid off', 'lack of alignment with job requirements', 'hidden unemployment from family', 'exhaustion', 'nepotism']","The post reflects on the challenges of job searching and the emotional toll it takes, ultimately leading to accepting a position through nepotism after a long struggle.",I am now starting as a Systems Engineer at a family friend's company next month.,positive,True,False,US,1k4dbtu,cscareerquestions,I gave up after 2 years and took the easy way out,2678,https://reddit.com/r/cscareerquestions/comments/1k4dbtu/i_gave_up_after_2_years_and_took_the_easy_way_out/,2025-04-21,True,
job_search,Software Engineer,,,Technology,"['pipeline warnings', 'credentials borrowing']",The user is seeking suggestions for making a good impression before their onboarding meeting.,The user successfully found a new job at Azure after leaving AWS.,positive,True,False,,1ojbebq,cscareerquestions,Just pushed my first PR for my new job at Azure after leaving AWS!,2543,https://reddit.com/r/cscareerquestions/comments/1ojbebq/just_pushed_my_first_pr_for_my_new_job_at_azure/,2025-10-29,False,
workplace_conflict,Software Engineer,,4.0,Technology,"['poor work culture', 'lack of collaboration processes', 'high risk software development', 'arbitrary deadlines', 'burnout']","The author reflects on their negative experiences at Google, emphasizing the misalignment of work processes and culture with their own values and approach to software development.",I recently left Google after nearly four years.,negative,True,False,,1kslf3b,cscareerquestions,"After 4 years at Google, here's my honest take on why their work culture and processes didn't work for me.",2432,https://reddit.com/r/cscareerquestions/comments/1kslf3b/after_4_years_at_google_heres_my_honest_take_on/,2025-05-22,True,
workplace_conflict,,Big Tech job,,,"['toxic manager', 'personal insults', 'working weekends', 'zombie projects']",The post expresses relief and excitement about leaving a toxic work environment and securing a new job that aligns with personal goals.,I GOT THE JOB!!,positive,True,False,,1ozlobb,cscareerquestions,I GOT THE JOB!! F*** MY OLD MANAGER!!!,2283,https://reddit.com/r/cscareerquestions/comments/1ozlobb/i_got_the_job_f_my_old_manager/,2025-11-17,True,
job_search,,,,,"['unemployment', 'financial struggles', 'coercive recruiter tactics', 'silent offer rescind']",The post shares an experience with a coercive recruiter and highlights the importance of handling such situations calmly.,The offer was silently rescinded without warning or explanation.,negative,True,False,,1mqzjgz,cscareerquestions,Recruiter mocked my unemployment and financial situation. How would you have handled this?,1923,https://reddit.com/r/cscareerquestions/comments/1mqzjgz/recruiter_mocked_my_unemployment_and_financial/,2025-08-15,False,
job_search,SWE,Help Desk,4.0,technology,"['hundreds of applications with no success', 'ghosting from employers', 'rejections from entry-level roles', 'remote bait and switch', 'emergency fund almost dry']",The post highlights the challenges of job searching in a tough market and suggests increasing emergency funds.,"He had to settle and get a job as a bartender in Santa Cruz, which he actually likes.",positive,True,False,Santa Cruz,1omzo49,cscareerquestions,My laid-off 4 YOE former Microsoft SWE CS UMich grad friend has capitulated. He had to get a job as a bartender.,1842,https://reddit.com/r/cscareerquestions/comments/1omzo49/my_laidoff_4_yoe_former_microsoft_swe_cs_umich/,2025-11-03,True,
job_search,new grad,,,software,"['recent graduate', 'high competition', 'time-consuming application process', 'lack of feedback', 'burnout']","The poster is seeking support and understanding after a frustrating job application experience, feeling drained and considering leaving the software industry.",The poster was rejected after the final interview with the CEO.,negative,True,False,,1m62df3,cscareerquestions,[Rant] Rejected in 15 minutes by CEO after 4 rounds and days of work,1569,https://reddit.com/r/cscareerquestions/comments/1m62df3/rant_rejected_in_15_minutes_by_ceo_after_4_rounds/,2025-07-22,True,
workplace_conflict,embedded software engineer,,6.0,technology,"['deeply ingrained envy problem', 'lack of recognition', 'resistance to change', 'promotion based on seniority', 'cultural differences']",The post highlights the challenges of being innovative in a workplace that rewards conformity and seniority over actual contributions. The author seeks validation for their experiences and advice on navigating this culture.,"The author was not recognized for their contributions, while a colleague who resisted change was promoted.",negative,True,False,Germany,1saxvcj,cscareerquestions,German tech companies punish people who actually build things. I'm done. Moving to the US next year.,1194,https://reddit.com/r/cscareerquestions/comments/1saxvcj/german_tech_companies_punish_people_who_actually/,2026-04-02,False,
job_search,,computer science,1.0,technology,"['no internships', 'ghosted by companies', 'multiple interview cancellations', 'low salary', 'not where I want to be']","It took a long time and was hard, but perseverance can lead to success in job searching.",Started a new job a couple weeks ago.,positive,True,True,,1m1gnz0,cscareerquestions,I did it.,1180,https://reddit.com/r/cscareerquestions/comments/1m1gnz0/i_did_it/,2025-07-16,True,
job_search,developer,,2.0,technology,"['market is terrible for new-grads', 'salary expectations are much lower in South America', 'doubt about average TC for developers with 2 YOE']",The poster is seeking clarification on salary expectations and job market conditions for junior developers in the U.S. compared to South America.,unbeliavable*. Thanks for all replies!,mixed,True,True,South America,1m78mov,cscareerquestions,Big Tech reality in U.S is just unbeliaveble.,1161,https://reddit.com/r/cscareerquestions/comments/1m78mov/big_tech_reality_in_us_is_just_unbeliaveble/,2025-07-23,True,
job_search,Mid-Level Software Engineer L4,,2.0,technology,"['market is tough', 'competition is rough', 'job search took 9 months']","Stay disciplined and put in hard work, as it will pay off despite the tough job market.",Landed a job at Meta earlier this year.,positive,True,True,,1l5apme,cscareerquestions,Got an offer from Meta - here are my tips,1145,https://reddit.com/r/cscareerquestions/comments/1l5apme/got_an_offer_from_meta_here_are_my_tips/,2025-06-07,True,
job_search,Entry level,,2.0,Computer Science,"['applied to over 750 jobs', 'custom resumes and cover letters', 'rejected after final round', 'lack of connections', 'feeling of wasted time']","The poster advises against entering the field without connections, expressing frustration over the job market and their own efforts.",The poster is considering going back to college.,mixed,True,False,,1oobong,cscareerquestions,Entry level doesn’t exist anymore,1022,https://reddit.com/r/cscareerquestions/comments/1oobong/entry_level_doesnt_exist_anymore/,2025-11-04,False,
job_search,,,0.0,,"['lack of experience on stack', 'rejection from desired startup', 'ghosting from another company', 'high number of applications without success', 'frequent resume reoptimizations']",The poster is seeking advice on how to improve their job search after facing multiple rejections despite their efforts.,The poster received rejections and ghosting from companies after applying to many jobs.,negative,True,False,,1kiajlw,cscareerquestions,I cannot take it anymore,978,https://reddit.com/r/cscareerquestions/comments/1kiajlw/i_cannot_take_it_anymore/,2025-05-09,True,
salary_negotiation,Software Engineer,,,startup,"['turned down a higher salary', 'felt off about the new role', ""team's negative reaction"", 'lack of RSUs', 'second-guessing decision']","The author reflects on their decision to turn down a Google offer for a startup role, seeking validation from others who have made similar choices.","Eight months later, the startup is still alive, the author received a small raise, and they have shipped three features that users engage with.",positive,True,True,,1rorcj5,cscareerquestions,I said no to a Google offer last year and my coworkers thought I was insane,976,https://reddit.com/r/cscareerquestions/comments/1rorcj5/i_said_no_to_a_google_offer_last_year_and_my/,2026-03-09,True,
job_search,founding backend engineer,,0.0,tech,"['depression', 'lack of routine', 'poor self-care', 'many interviews']",The post encourages others to keep pushing through tough times and emphasizes the importance of taking small steps towards improvement.,Landed a dream position as a founding backend engineer at an SF startup.,positive,True,False,SF,1m54b0p,cscareerquestions,I did it WAHOO YEAH,959,https://reddit.com/r/cscareerquestions/comments/1m54b0p/i_did_it_wahoo_yeah/,2025-07-21,False,
salary_negotiation,Cloud Engineer,,0.0,tech,"['lowball offer', 'budget limits', 'new grad', 'high salary expectations', 'contract position']",The poster is seeking advice on whether their salary expectations are realistic and if the offer they received is a lowball.,"They revised their offer to a 6-month, $30/hr contract. The poster accepted the offer and is back to job hunting.",mixed,True,True,Chicago Suburb,1ndutfx,cscareerquestions,Was I delusional to ask for $130k? New grad offer in Chicago is $62k.,845,https://reddit.com/r/cscareerquestions/comments/1ndutfx/was_i_delusional_to_ask_for_130k_new_grad_offer/,2025-09-11,True,
job_search,senior engineer,,,software engineering,"['COVID era job market', 'lack of passion', 'difficulty finding a job']","Reflect on your motivations for pursuing a career in software engineering, especially if it's just for the money, as the market has changed significantly.","The post received a significant drop in upvotes, indicating a negative reception.",negative,True,False,,1qywjxe,cscareerquestions,"If you're here simply because you are looking to make a lot of money, you're in the wrong place",803,https://reddit.com/r/cscareerquestions/comments/1qywjxe/if_youre_here_simply_because_you_are_looking_to/,2026-02-08,True,
layoff,SWE,,2.0,government contracting,"['job market concerns', 'mounting student debt', 'long commute']",The post encourages others not to lose hope despite challenges in the job market.,Landed an amazing offer with a significant salary increase.,positive,True,True,,1ourptl,cscareerquestions,Amazing Offer,794,https://reddit.com/r/cscareerquestions/comments/1ourptl/amazing_offer/,2025-11-12,False,
burnout,,software developer,,software development,"['fired', 'burnout', 'micromanagement', 'chaotic codebase', 'tight timeline to find new job']",The poster is seeking advice on how to avoid similar situations in the future and land a better job quickly.,Fired and now looking for a new job within a month.,negative,True,False,Dubai,1rcoxa0,cscareerquestions,Fired today in Dubai after hitting my limit with “vibe-coded” chaos,778,https://reddit.com/r/cscareerquestions/comments/1rcoxa0/fired_today_in_dubai_after_hitting_my_limit_with/,2026-02-23,False,
job_search,IT consultant,,20.0,Fintech,"['interview feedback about AI usage', 'pressure to adopt vibe coding', 'disappointment from interviewers']","The post discusses the challenges faced during job interviews where the emphasis is on using AI for coding tasks, contrasting with the author's preference for understanding code deeply.",I didn't get the job.,negative,True,False,,1rn8e3g,cscareerquestions,"Have we, professional developers, already lost the battle against vibe coding?",762,https://reddit.com/r/cscareerquestions/comments/1rn8e3g/have_we_professional_developers_already_lost_the/,2026-03-07,True,
job_search,Backend dev,,5.0,f500,"['wasted time in early interviews', 'rejections from virtual on-sites', 'commute over 1 hour each way']",The post highlights the importance of being fully prepared before starting interviews and the challenges of job searching in the current market.,Accepted an offer of 232k after 6 months of searching.,positive,True,True,Chicago,1qvd25v,cscareerquestions,"Finally got an offer(s) after 4-6 months of search. 150k TC -&gt; 232k, 5 yoe",701,https://reddit.com/r/cscareerquestions/comments/1qvd25v/finally_got_an_offers_after_46_months_of_search/,2026-02-04,True,
job_search,software engineer,,,,"['tech stack not preferred', 'requirement to work from office', 'time constraints for assessments', 'dislike for algorithm challenges']","The poster is seeking validation from others who have refused to participate in hiring processes that involve HackerRank assessments, expressing concerns about their effectiveness.",The poster decided to withdraw from consideration for the role.,negative,True,False,,1qknml5,cscareerquestions,Refusing HackerRank questions,698,https://reddit.com/r/cscareerquestions/comments/1qknml5/refusing_hackerrank_questions/,2026-01-23,False,
career_switch,IT,,20.0,IT,"['current job dissatisfaction', 'personal family issues', 'age considerations', 'financial stability', 'desire for early retirement']","The poster reflects on their career and personal life, expressing a desire to transition out of their current job and focus on coding for personal fulfillment.",The poster plans to leave their job in January 2026 and move back to Asia.,positive,True,False,Asia,1mp9rll,cscareerquestions,Rant: I'm getting out,699,https://reddit.com/r/cscareerquestions/comments/1mp9rll/rant_im_getting_out/,2025-08-13,True,
job_search,full stack developer,,8.0,tech,"['laid off', 'non-native English speaker', 'difficulty outsourcing job applications', 'anxiety about applying', 'competition with junior engineers']","The user shares their experience of applying to numerous jobs and negotiating offers, emphasizing the importance of tailored resumes and networking.",Accepted an offer from a company they really liked after receiving multiple offers.,positive,True,True,US,1npw1h9,cscareerquestions,Is tech job market really cooked ?,691,https://reddit.com/r/cscareerquestions/comments/1npw1h9/is_tech_job_market_really_cooked/,2025-09-25,True,
workplace_conflict,,,,,"['manager expects weekend work', 'family commitments', 'lack of notice for weekend work', 'manager unhappy with work-life balance', 'team culture of working extra hours']",The poster is seeking advice on how to handle their manager's expectations for weekend work while prioritizing family time.,Now I'm brushing up my resume. Haven’t interviewed in over 10 years.,mixed,True,False,,1mjmc3s,cscareerquestions,Rant: Being expected to work weekends last minute – manager not happy I have a life,688,https://reddit.com/r/cscareerquestions/comments/1mjmc3s/rant_being_expected_to_work_weekends_last_minute/,2025-08-07,False,
job_search,COBOL developer,,0.0,software development,"['concern about being trapped in legacy systems', 'limited job opportunities in desired field', 'guilt about leaving after training', 'wanting to stay close to family']","The user is seeking advice on whether to continue applying for other jobs while accepting a COBOL position, considering the potential limitations of the role.","I took the job! Thanks so much for the replies, It's helped me see the job in a new light.",positive,True,False,,1lbf966,cscareerquestions,Finally got job offer but it's COBOL.,654,https://reddit.com/r/cscareerquestions/comments/1lbf966/finally_got_job_offer_but_its_cobol/,2025-06-14,True,
job_search,frontend developer,,12.0,,"['missing CSS qualification', 'keywords not space delimited']",Ensure your keywords are properly formatted for applicant tracking systems and follow up if something feels off during the hiring process.,I ended up getting a great offer for this position and took it.,positive,True,False,,1kp86db,cscareerquestions,"Auto-rejected from a great match, so I found a way to follow up...",653,https://reddit.com/r/cscareerquestions/comments/1kp86db/autorejected_from_a_great_match_so_i_found_a_way/,2025-05-18,True,
layoff,Senior engineer,,7.0,,"['mental health issues', 'two year employment gap', 'financial instability', 'difficulty with interviews', 'lack of access to therapy']",The poster seeks understanding and advice on how to cope with their struggles after being laid off and dealing with mental health issues.,The poster is currently unemployed and feels frozen in their job search.,negative,True,False,,1opqxkh,cscareerquestions,I’m washed,608,https://reddit.com/r/cscareerquestions/comments/1opqxkh/im_washed/,2025-11-06,True,
job_search,software engineer,role at a unicorn,,tech,"['lower pay', 'commute', 'RTO', 'recently started new role']",The poster is seeking advice on how to handle recruiter calls and interviews given their recent job change and the rejection they faced.,Rejected the next day because the hiring manager was worried about their willingness to leave their current role.,negative,True,True,,1kwti2h,cscareerquestions,Rejected because I was too willing to leave my current role,610,https://reddit.com/r/cscareerquestions/comments/1kwti2h/rejected_because_i_was_too_willing_to_leave_my/,2025-05-27,True,
burnout,engineer,,,startup,"['high expectations from boss', 'intense stress', 'lack of sleep', 'constant self-deprecation', 'feeling mediocre']","The post reflects on the intense burnout experienced due to high expectations and stress at work, leading to a decision to quit.","The boss didn't want the user to quit, but the user felt that quitting was the only way out of the burnout.",mixed,True,False,,1m2nz4j,cscareerquestions,I quit my job. In this economy.,599,https://reddit.com/r/cscareerquestions/comments/1m2nz4j/i_quit_my_job_in_this_economy/,2025-07-18,True,
job_search,PHP Developer,,10.0,,"['lack of growth opportunities', 'time wasted on coding assessments', 'high competition for jobs']",The post expresses frustration over the industry's acceptance of lengthy coding assessments without compensation and questions the ethics behind it.,I was passed on after the interview.,negative,True,False,,1kupmqq,cscareerquestions,Why is the industry ok with this?,587,https://reddit.com/r/cscareerquestions/comments/1kupmqq/why_is_the_industry_ok_with_this/,2025-05-25,True,
job_search,backend engineer,software engineer,,non-profit,"['no university degree', 'no boot camp', 'high competition', 'many rejections', 'tough market']","Keep trying and stay motivated, as it is possible to land a job with the right skills and hard work.",Received a full-time remote position as a software engineer.,positive,True,True,remote,1ksxljy,cscareerquestions,Just Received a Fully Remote Job Offer as a Self Taught SWE - Spreading Some Positivity and Hope,578,https://reddit.com/r/cscareerquestions/comments/1ksxljy/just_received_a_fully_remote_job_offer_as_a_self/,2025-05-22,True,
career_switch,,,,,"['tired after work', 'concern about being seen interviewing', 'lack of time to prepare for interviews', 'low salary hikes', 'managers being picky']",The post discusses the challenges of switching jobs while working in the office and suggests that remote work facilitates easier job transitions.,Of course people switch even with wfo but it's much harder.,mixed,True,False,,1nhfxtb,cscareerquestions,RTO is done to prevent Job switching,561,https://reddit.com/r/cscareerquestions/comments/1nhfxtb/rto_is_done_to_prevent_job_switching/,2025-09-15,True,
job_search,,,,,"['laid off', 'rejected from interviews', 'reworking resume', 'polishing profile', 'submitted 1000 applications']",The post suggests creating a community to collaborate on projects and share ideas to utilize skills and knowledge effectively.,Thanks for all your comments and ideas. Also informed about Build In Public community.,positive,True,False,,1kq8hq3,cscareerquestions,"""F*k it, lets build startups",539,https://reddit.com/r/cscareerquestions/comments/1kq8hq3/fk_it_lets_build_startups/,2025-05-19,True,
job_search,CS graduate,,1.0,technology,"['high competition', 'low initial offers', 'ATS rejection', 'interview performance', 'nerves during interviews']","Focus on creating an ATS-friendly resume, practice behavioral interviews using the STAR method, and negotiate every job offer to maximize salary.","I received two job offers at $60K, but learned that I could have negotiated for more.",mixed,True,True,Manhattan,1rvzf6t,cscareerquestions,I graduated CS in 2022 and applied to 1800 jobs. Here is everything I learned the hard way,536,https://reddit.com/r/cscareerquestions/comments/1rvzf6t/i_graduated_cs_in_2022_and_applied_to_1800_jobs/,2026-03-17,True,
layoff,part-time sales/floor advisor,SWE/programming,3.0,retail,"['feeling of burnout', 'hundreds of applications', 'failed interactions with recruiters', 'unable to get an interview']",The poster is seeking advice on how others have navigated similar situations after being laid off and whether they found jobs in tech or pivoted to other fields.,The poster was recently hired as a part-time sales/floor advisor for a retail store.,mixed,True,False,,1p1sxmw,cscareerquestions,"Those who got laid off within the last 2 years and haven't been able to go back into a SWE/programming career, what field/industry did you pivot into?",536,https://reddit.com/r/cscareerquestions/comments/1p1sxmw/those_who_got_laid_off_within_the_last_2_years/,2025-11-20,False,
job_search,full stack engineer,DevOps or a related role,2.0,,"['applied to over 500 jobs', 'only got a few interviews', 'not motivated to study a trade', ""doesn't want to live at home for years"", 'feels the job market is poor']",The poster is frustrated with the job market and is seeking validation for their decision to not pursue a trade despite pressure from others.,Looking into DevOps or a related role.,unknown,True,False,,1npqsk8,cscareerquestions,“Just join the trades bro” fuck that.,534,https://reddit.com/r/cscareerquestions/comments/1npqsk8/just_join_the_trades_bro_fuck_that/,2025-09-24,True,
job_search,recent graduate,software development,1.0,technology,"['limited skills for software development', 'scarcity of IT help desk roles', 'scarcity of QA roles', 'scarcity of analyst roles', 'competitive job market']",The poster is seeking advice on whether taking a non-tech job will diminish the value of their CS degree and how difficult it will be to transition back to a tech role later.,Today I finally got a job offer as a data specialist for a small company.,mixed,True,False,,1mis0vt,cscareerquestions,If I can’t get a tech job a year after graduating will my CS degree eventually become pointless?,530,https://reddit.com/r/cscareerquestions/comments/1mis0vt/if_i_cant_get_a_tech_job_a_year_after_graduating/,2025-08-06,True,
layoff,Senior Software Engineer,,5.0,Healthcare,"['Job market perception', 'Limited entry-level positions', 'Hybrid work requirements']","Despite the negative outlook on layoffs, the job market for senior roles remains relatively healthy, and it's important to apply directly to roles that match your skillset.",Signed an offer today.,positive,True,True,US,1m9n8ew,cscareerquestions,Got Laid Off 12 Days Ago and Signed an Offer Today - Here's My Sankey Diagram,528,https://reddit.com/r/cscareerquestions/comments/1m9n8ew/got_laid_off_12_days_ago_and_signed_an_offer/,2025-07-26,True,
job_search,,senior-level role,,,"['rough interview experiences', 'role reposted with lower salary range', 'company passing on candidate']","The poster is seeking advice on navigating the job market and interview process, especially after a disappointing experience with a potential employer.",The poster received an email saying they’ve decided to pass on me.,negative,True,True,SF Bay Area,1n2v5rt,cscareerquestions,SF Bay Area - The job market is cooked,529,https://reddit.com/r/cscareerquestions/comments/1n2v5rt/sf_bay_area_the_job_market_is_cooked/,2025-08-29,False,
other,,,,,"['introverted', 'feeling awkward', 'struggling in interviews', 'difficulty in networking', 'challenges in team projects']","Social skills can be trained and improved through practice, similar to learning a language or training a muscle.",Using the app Gleam has helped maintain and improve social skills and confidence.,positive,True,False,,1nkttp4,cscareerquestions,"Nobody tells you this, but social skills are TRAINABLE like a language",523,https://reddit.com/r/cscareerquestions/comments/1nkttp4/nobody_tells_you_this_but_social_skills_are/,2025-09-19,True,
workplace_conflict,Software Engineer,,1.0,Technology,"['Poor relationship with manager', 'Consistent criticism', 'Lack of support', 'Vague performance feedback', 'Company layoffs']",The post seeks advice on how to navigate a performance improvement plan or consider severance after a difficult year with a manager.,The author is being offered a choice between a performance improvement plan (PIP) and severance.,mixed,True,False,,1l03xpo,cscareerquestions,"Fired from Big Tech, &lt;1 YOE.",511,https://reddit.com/r/cscareerquestions/comments/1l03xpo/fired_from_big_tech_1_yoe/,2025-05-31,True,
