problem_type,current_role,target_role,years_experience,industry,constraints,advice_summary,outcome,outcome_sentiment,has_outcome,salary_mentioned,location,post_id,subreddit,title,score,url,created_date,has_update,_error
job_search,,,,,"['interviews felt polished but lacked real insight', 'difficulty in assessing day-to-day job reality']",The author seeks advice on effective questions to ask during interviews to uncover the true nature of the job and team dynamics.,I didn't take that job.,negative,True,False,,1s26iaq,careerguidance,What questions do you ask in interviews to find out what the job is actually like — not just what they want you to hear?,36,https://reddit.com/r/careerguidance/comments/1s26iaq/what_questions_do_you_ask_in_interviews_to_find/,2026-03-24,True,
layoff,Senior Tech Writer,,9.0,,"['needs visa sponsorship', 'fired without warning', 'no access to personal belongings', 'lack of job offers', 'poor AI performance']",The poster seeks advice on how to regain composure and navigate the job search after being laid off under difficult circumstances.,The individual who caused the layoff is leaving the company after 8 months.,positive,True,False,,1sgsceu,careerguidance,How to regain hope after being disgracefully fired?,32,https://reddit.com/r/careerguidance/comments/1sgsceu/how_to_regain_hope_after_being_disgracefully_fired/,2026-04-09,True,
layoff,SDR,SDR,,,"['internal environment issues', 'office politics', 'communication issues', 'toxicity', 'sexism']","The poster is seeking advice on staying positive after being let go, discussing the situation in interviews, exploring similar roles, and whether to take time off or focus on job hunting.",The poster was let go unexpectedly from their SDR role.,negative,True,False,,1scttf1,careerguidance,Where do I go from here?,29,https://reddit.com/r/careerguidance/comments/1scttf1/where_do_i_go_from_here/,2026-04-05,False,
layoff,,,,,"['lack of social life', 'missing colleagues', 'emotional impact of layoff']",The poster is seeking advice on how to cope with the emotional impact of losing their colleagues after being laid off.,Got great interviews and 1-2 might even convert to an actual offer.,positive,True,False,,1saz9zp,careerguidance,Got laid off but the worst part is different for me?,30,https://reddit.com/r/careerguidance/comments/1saz9zp/got_laid_off_but_the_worst_part_is_different_for/,2026-04-03,False,
workplace_conflict,ice cream shop worker,,0.0,food service,"['feeling underperforming', 'difficulty focusing', 'anxiety', 'perceived unfriendliness', 'conflict with coworkers']",The poster is seeking advice on whether to ask for feedback from their boss and how to handle their negative experience at work.,"After snapping at a coworker, she became nicer and there are no more issues with her.",positive,True,False,,1seg9eg,careerguidance,Awful experience at my 1st full-time job - is it normal to be this bad at it after a month?,29,https://reddit.com/r/careerguidance/comments/1seg9eg/awful_experience_at_my_1st_fulltime_job_is_it/,2026-04-07,False,
other,,,4.0,,"['new manager', 'lack of rapport', 'market conditions', 'fear of job loss', 'health risks']","The user sought reassurance about taking full advantage of maternity leave and short-term disability benefits, ultimately deciding to take what they are owed.",I'm going to go ahead and take what I'm owed.,positive,True,False,NY,1rvuaih,careerguidance,Should I max out my maternity leave by adding on short term disability?,20,https://reddit.com/r/careerguidance/comments/1rvuaih/should_i_max_out_my_maternity_leave_by_adding_on/,2026-03-17,True,
job_search,,,0.0,AI tech,"['ghosted after interviews', 'unprofessional experience', 'long travel time', 'high costs for travel', 'sexist environment']",The poster is seeking advice on how to handle being ghosted after multiple interviews and a negative experience at a startup.,They were ghosted after 3 months of the experience.,negative,True,True,SF,1se3yj6,careerguidance,Ghosted after 6 rounds? Advice?,18,https://reddit.com/r/careerguidance/comments/1se3yj6/ghosted_after_6_rounds_advice/,2026-04-06,True,
education_decision,account manager,project manager,1.0,tech,"['lower salary', 'long commute', 'unpaid overtime', 'limited internal promotions', 'time for personal life']",The poster is seeking advice on whether to choose a lower-paying job that offers better long-term career growth or a higher-paying job with potential drawbacks.,The poster has already signed with Company A.,positive,True,True,,1s1v5h0,careerguidance,Is the higher salary always the right move early in your career?,13,https://reddit.com/r/careerguidance/comments/1s1v5h0/is_the_higher_salary_always_the_right_move_early/,2026-03-23,False,
education_decision,,fellowship,,,"['rude interview experience', 'uncertainty about fellowship quality', 'never lived on my own', 'mixed opinions from alumna']",The poster is seeking advice on whether to accept a fellowship offer after a negative interview experience or stick to their master's plan.,The poster has been selected for the fellowship.,mixed,True,False,own country,1rteuuw,careerguidance,Should I accept an offer after a rude interview?,13,https://reddit.com/r/careerguidance/comments/1rteuuw/should_i_accept_an_offer_after_a_rude_interview/,2026-03-14,True,
education_decision,,IO psych or urban planning,,,"['feeling of wasted time/money', 'social pressure to stay in college', 'current job market not looking good']","The poster is seeking advice on how to cope with their college experience and the usefulness of their interdisciplinary degree, while considering options for grad school or extending their graduation.",A third option would be to extend my graduation and complete a non-interdisciplinary degree like math or physics.,mixed,True,False,,1scjqdb,careerguidance,What do I do with my interdisciplinary degree?,12,https://reddit.com/r/careerguidance/comments/1scjqdb/what_do_i_do_with_my_interdisciplinary_degree/,2026-04-04,True,
job_search,,,,,"['living in a dead spot', 'nervous during interviews', 'low starting salary']","The poster reflects on their unexpected success in job interviews despite feeling unprepared and nervous, emphasizing the importance of being ready and professional.",Received an offer letter after a nervous interview.,positive,True,False,,1rxbk7s,careerguidance,Why do I get hired after a bad interview??,10,https://reddit.com/r/careerguidance/comments/1rxbk7s/why_do_i_get_hired_after_a_bad_interview/,2026-03-18,True,
layoff,C-level exec,Home Depot employee,16.0,financial services,"['bad vibes from CEO', 'unethical financial practices', 'desire to avoid corporate office bullshit']",The individual sought advice on leaving a toxic work environment after being laid off and finding a new job.,Resigned from the new job immediately after realizing the CEO's unethical practices.,positive,True,False,,1mwq4ic,financialindependence,"I made use of my ""Fuck You"" money today.",20156,https://reddit.com/r/financialindependence/comments/1mwq4ic/i_made_use_of_my_fuck_you_money_today/,2025-08-21,True,
layoff,,,30.0,CPG,"['multiple layoffs', 'age', 'financial responsibilities', 'job market changes', 'personal circumstances']","The post reflects on the challenges of being laid off multiple times and the lessons learned throughout the career, ultimately leading to retirement.","This will be the last layoff for me, as this marks my unceremonious retirement.",positive,True,True,,1m7hn9i,financialindependence,Laid off for the Fourth and Final time,1742,https://reddit.com/r/financialindependence/comments/1m7hn9i/laid_off_for_the_fourth_and_final_time/,2025-07-23,True,
other,,,20.0,,[],Focus on having something to sell besides your time and develop a strong vision for your post-career life.,Celebrating twenty years of early retirement.,positive,True,False,,1lnxgdg,financialindependence,Looking back on twenty years of early retirement.,1702,https://reddit.com/r/financialindependence/comments/1lnxgdg/looking_back_on_twenty_years_of_early_retirement/,2025-06-30,True,
career_switch,Wall Street,paramedic,,finance,[],The story highlights the journey of someone who transitioned from a high-paying finance job to a fulfilling career in emergency services.,He is now one of the best paramedics in New York City.,positive,True,True,New York City,1n7g7b2,financialindependence,The Millionaire Who Left Wall Street to Become a Paramedic,929,https://reddit.com/r/financialindependence/comments/1n7g7b2/the_millionaire_who_left_wall_street_to_become_a/,2025-09-03,False,
education_decision,teacher,,20.0,education,"['fear of retirement', 'financial uncertainty']","The user sought advice on whether they could retire early and received positive feedback from various sources, leading them to make the decision to retire.",The user officially notified their principal that this will be their last year teaching.,positive,True,False,,1q65weh,financialindependence,"I'm 46yo (47 in a few months), been a teacher since the early 00s. Thanks to all of your advice, i put in my notice today that i will be leaving the school at the completion of this school year and retiring early.",934,https://reddit.com/r/financialindependence/comments/1q65weh/im_46yo_47_in_a_few_months_been_a_teacher_since/,2026-01-07,False,
other,,,,,"['financial illiteracy', 'overspending', 'divorce', 'cash heavy']",The author expresses gratitude for the advice received on their financial journey and acknowledges the overwhelming nature of getting on the right financial path.,The author has reached a net worth of $100k and feels amazing about it.,positive,True,True,,1k7pu3y,financialindependence,I (26M) just hit $100k net worth today!!!!!,888,https://reddit.com/r/financialindependence/comments/1k7pu3y/i_26m_just_hit_100k_net_worth_today/,2025-04-25,True,
other,military member,,,military,"['moving for work', 'being sent away for 6 months to a year on short notice', 'meaningful and consistent employment for military spouses']",The post shares a successful retirement story and emphasizes the importance of saving aggressively and having a supportive spouse.,The author has completed their work responsibilities and is retiring at 42.,positive,True,True,,1onbzmb,financialindependence,I made it. Can't tell anyone I know so I figured I'd share here,771,https://reddit.com/r/financialindependence/comments/1onbzmb/i_made_it_cant_tell_anyone_i_know_so_i_figured_id/,2025-11-03,True,
other,former accountant,,,,[],"The post reflects on the positive experiences of living in Japan after achieving financial independence, emphasizing personal growth and cultural immersion.","All is well; I'm still FIREd, happy and thriving.",positive,True,False,Japan,1kei4n5,financialindependence,Post-FIRE 3yr Update: 37F SINK former accountant,667,https://reddit.com/r/financialindependence/comments/1kei4n5/postfire_3yr_update_37f_sink_former_accountant/,2025-05-04,True,
other,engineer,,25.0,engineering,"['unable to negotiate more pay', 'unable to negotiate reduced hours', 'feeling of letting colleagues down']","It's empowering to approach negotiations without the need to work, and it's important to remember that financial independence can come from various backgrounds.",I will be retired next week!,positive,True,True,US and Canada,1p7ndyi,financialindependence,Pulled the trigger yesterday,617,https://reddit.com/r/financialindependence/comments/1p7ndyi/pulled_the_trigger_yesterday/,2025-11-26,True,
other,IT Consulting,,7.0,IT,[],"The post reflects on personal growth and experiences after achieving financial independence, rather than seeking specific advice.",Net worth increased from $2.09M to $2.36M in 2025.,positive,True,False,SF Bay Area,1qehdjt,financialindependence,7 Years FIRE'd and My First Romance (42M),568,https://reddit.com/r/financialindependence/comments/1qehdjt/7_years_fired_and_my_first_romance_42m/,2026-01-16,True,
burnout,tech,,2.0,technology,"['burnout', 'physical symptoms of stress and anxiety', 'risk-adverse investment strategy', 'slight decline in net worth']",The main advice is to take a sabbatical if you're feeling burnt out; it's a decision you won't regret.,They have been on a sabbatical for a year and are traveling internationally.,positive,True,False,,1q3xyuv,financialindependence,FIRE Update: One Year Ago I Quit My Job With a 935K NW - Here's How It's Going,570,https://reddit.com/r/financialindependence/comments/1q3xyuv/fire_update_one_year_ago_i_quit_my_job_with_a/,2026-01-04,True,
career_switch,tourism,,10.0,tourism,"['initial corporate job dissatisfaction', 'debt from university', 'high spending in early career']","The post emphasizes the importance of continuous investing and a high savings rate, along with the impact of career changes on income.",Currently sitting at a net wealth of $1.6m and enjoying financial benefits in Japan.,positive,True,True,Japan,1ltubkc,financialindependence,The Slow Path to Wealth Was Quicker Than Advertised,565,https://reddit.com/r/financialindependence/comments/1ltubkc/the_slow_path_to_wealth_was_quicker_than/,2025-07-07,False,
other,,,4.0,,"['no trust fund', 'no tech salary', 'no windfalls', 'average money', 'sometimes below average']","The post reflects on the importance of mindset shifts in achieving financial independence, emphasizing persistence over perfection.",I feel calm for the first time in a long while.,positive,True,False,,1lk1oh0,financialindependence,Didn’t hit six figures or win the lottery just made peace with slow progress,542,https://reddit.com/r/financialindependence/comments/1lk1oh0/didnt_hit_six_figures_or_win_the_lottery_just/,2025-06-25,True,
other,,,15.0,,"['feeling of not being wealthy', 'fear of losing wealth']",The post reflects on the journey to financial independence and the unexpected feelings that come with reaching a significant financial milestone.,The author has reached a net worth of over 1 million dollars.,positive,True,False,,1mjh4mu,financialindependence,Happy post - I hit 1M,520,https://reddit.com/r/financialindependence/comments/1mjh4mu/happy_post_i_hit_1m/,2025-08-06,False,
other,area manager,,5.0,distribution,"['difficult divorce', 'financial instability', 'career struggles']","The post reflects on a journey of recovery and financial independence after a difficult period, emphasizing the importance of perseverance and education.","I am happily remarried, earning over $90,000, our debt has been reduced by almost half, and our net worth has passed $214,000.",positive,True,True,,1me1wc1,financialindependence,5 Years into FIRE: From $5k After Divorce to $214k Net Worth and a New Marriage,486,https://reddit.com/r/financialindependence/comments/1me1wc1/5_years_into_fire_from_5k_after_divorce_to_214k/,2025-07-31,True,
other,,,2.0,,[],"The article suggests that retirees may benefit from a higher withdrawal rate than 4%, potentially up to 4.7%, and emphasizes the importance of portfolio diversification and rebalancing.",I stepped away from work over two years ago and I am much closer to 5% withdrawal rate than 4%.,positive,True,False,,1ldo31x,financialindependence,4% Rule Creator says 4.7% is new Safe Withdrawl Rate or higher,437,https://reddit.com/r/financialindependence/comments/1ldo31x/4_rule_creator_says_47_is_new_safe_withdrawl_rate/,2025-06-17,True,
other,,,,,"['general stresses from work', 'impact on health', 'impact on relationships']",The post reflects on the benefits of taking time off work and the personal growth experienced during the FIRE journey.,Resigned in mid April 2024 and has been reflecting on the experience for a year.,positive,True,False,,1k41nww,financialindependence,1 Year FIRE Update!,415,https://reddit.com/r/financialindependence/comments/1k41nww/1_year_fire_update/,2025-04-21,True,
other,,,10.0,,"['fortunate starting position', 'no student debt', 'luck along the way']","The author shares their financial journey and insights on wealth accumulation through savings and investments, emphasizing the importance of a solid investment strategy.",The author has achieved a net worth of $2.53M and has set clear financial objectives for their family.,positive,True,False,,1mx6xt1,financialindependence,"15 Years to $2.5M, a retrospective",408,https://reddit.com/r/financialindependence/comments/1mx6xt1/15_years_to_25m_a_retrospective/,2025-08-22,True,
other,,,16.0,tech,[],The author shares their experiences and reflections on their financial independence journey after achieving FIRE.,Net worth increased from 4.1M to 4.7M over the past year.,positive,True,False,,1m7ml88,financialindependence,5 years of FIRE. Post-FIRE check-in with graph and thoughts [M 43: Net worth 4.1M → 4.7M],389,https://reddit.com/r/financialindependence/comments/1m7ml88/5_years_of_fire_postfire_checkin_with_graph_and/,2025-07-23,True,
other,,,,,"['net worth drop', 'poor mental health', 'spending concerns']",The author reflects on their financial journey post-retirement and considers how to manage their spending and net worth in the long term.,Now my net worth 3 years after that drop is $4.2m and I'm spending significantly below my 3% SWR.,positive,True,True,,1m1efeb,financialindependence,3.5 years post-FIRE - retiring in worst time in past 5 years,372,https://reddit.com/r/financialindependence/comments/1m1efeb/35_years_postfire_retiring_in_worst_time_in_past/,2025-07-16,True,
layoff,,,,Big Tech,"['no advanced degree', 'administrative overhead of teaching', 'income over ACA limit']","The post reflects on the positive experiences and activities undertaken after being involuntarily fired, emphasizing personal growth and financial success.","NW grew by $1.3M, income much higher than planned, while expenses are lower.",positive,True,False,,1pxeahn,financialindependence,Involuntarily FIRED - 1 year update,369,https://reddit.com/r/financialindependence/comments/1pxeahn/involuntarily_fired_1_year_update/,2025-12-28,True,
other,,,,,"['seller refused to return earnest money', 'took seller to small claims court', 'lived with a roommate I stopped being friends with']","The post shares personal financial milestones and experiences related to saving and investing, emphasizing the importance of understanding local laws regarding earnest money.",Hit $1 million in net worth.,positive,True,True,,1n94d9e,financialindependence,Hit 1 Million [34M][Single],328,https://reddit.com/r/financialindependence/comments/1n94d9e/hit_1_million_34msingle/,2025-09-05,True,
burnout,software engineer,,,tech,"['single parent', 'split custody', 'financial support for mother', 'high expenses due to divorce', 'mental health challenges']","The author reflects on their journey of financial independence and the challenges faced after a significant life change, emphasizing the importance of mental health and adjusting financial goals.","The author continues to work despite having hit their financial goals, indicating a complex relationship with their career and personal life.",mixed,True,True,MCOL location,1nuztzj,financialindependence,"In defense of ""One more year"": an update",318,https://reddit.com/r/financialindependence/comments/1nuztzj/in_defense_of_one_more_year_an_update/,2025-10-01,True,
career_switch,lawyer,,14.0,legal,"['high student loan burden', 'poor job market', 'dull work', 'toxic work environment', 'need to climb corporate ladder']","The author reflects on their journey of increasing their retirement number and the challenges faced along the way, emphasizing the importance of financial security.",The author reached a retirement number of $2.3 million and is considering increasing it to $3.5 million.,positive,True,True,US,1pdaofb,financialindependence,How I became a goalpost mover—a retrospective,282,https://reddit.com/r/financialindependence/comments/1pdaofb/how_i_became_a_goalpost_movera_retrospective/,2025-12-03,True,
burnout,,,,,"['anxiety from job connectivity', 'overstimulation from communication technologies', 'desire to disconnect from former colleagues']","The post reflects on the positive changes experienced after leaving a job, emphasizing the importance of mental peace and personal growth.",The author has successfully transitioned into a new chapter of life after giving notice and feels more at peace.,positive,True,False,,1qwwqa9,financialindependence,It feels as “right” as I’d hoped.,268,https://reddit.com/r/financialindependence/comments/1qwwqa9/it_feels_as_right_as_id_hoped/,2026-02-05,True,
other,,,,,[],The poster is curious about the reactions of others who have retired early and is seeking shared experiences.,The poster received a lot of feedback and appreciated the responses.,positive,True,False,,1md4q4m,financialindependence,For Those Who Have Fired:  How Did People React?,268,https://reddit.com/r/financialindependence/comments/1md4q4m/for_those_who_have_fired_how_did_people_react/,2025-07-30,True,
other,part-time job,,,engineering,"['student loans', 'recession', 'COVID-19', 'remote meetings', 'market fluctuations']",Maxing out the 401k and diversifying investments are key strategies for early retirement.,Quit working in 2021 and later took a remote part-time job.,positive,True,False,US,1os4cj4,financialindependence,Another successful early-ish retirement story,268,https://reddit.com/r/financialindependence/comments/1os4cj4/another_successful_earlyish_retirement_story/,2025-11-08,True,
career_switch,,,,,"['took a pay cut', 'higher-paying job was draining', 'no energy to think about the future']","The post reflects on the benefits of taking a lower-paying job for better work-life balance and mental health, encouraging others to share their experiences.",I feel like I'm building toward something real.,positive,True,True,,1lijqdv,financialindependence,"Switched jobs, took a pay cut — but finally feel like I’m moving toward the life I want",245,https://reddit.com/r/financialindependence/comments/1lijqdv/switched_jobs_took_a_pay_cut_but_finally_feel/,2025-06-23,True,
other,,,,,[],The post reflects on the author's financial independence journey and their experiences with expenses and lifestyle after retiring early.,The author has successfully retired and is celebrating their seven-year anniversary of being financially independent.,positive,True,False,,1rcbr40,financialindependence,Seven Year Update: 44 y/o FIREd,247,https://reddit.com/r/financialindependence/comments/1rcbr40/seven_year_update_44_yo_fired/,2026-02-23,True,
layoff,tech job,private tutoring and SAT test preparation,,technology,"['job market is tough', 'laid off', 'lower pay in new job']",The main advice sought is to remain calm during market fluctuations and not to panic when making investment decisions.,I got a job in August; it does not pay as much as it did when I was in tech.,mixed,True,False,VHCOL area,1o35dfg,financialindependence,Year Update after $1M: Laid Off,239,https://reddit.com/r/financialindependence/comments/1o35dfg/year_update_after_1m_laid_off/,2025-10-10,True,
other,,,,,"['limited income from SS and pension', 'no other assets', 'potential future living expenses', 'need to maximize returns', 'risk of drawing down cash']","The poster is seeking advice on how their relative can manage $250k cash for retirement without drawing it down, considering their limited income and future living expenses.","appreciating the advice that 'retirement is a number, not an age'",positive,True,False,,1ln2us9,financialindependence,"Relative is retirement age but needs to live on income from $250k cash. No other assets, no home. What to do?",231,https://reddit.com/r/financialindependence/comments/1ln2us9/relative_is_retirement_age_but_needs_to_live_on/,2025-06-29,True,
other,Finance + Technology,,,Finance + Technology,"['VHCOL city', 'limited vacation time', 'expected cost of living in retirement']",The post discusses plans for early retirement and strategies for living as nomads while managing expenses.,They have a tentative retirement date set for March 2026.,positive,True,False,"Boston, US",1ltx5py,financialindependence,Getting ready to be FIRE'd next year,218,https://reddit.com/r/financialindependence/comments/1ltx5py/getting_ready_to_be_fired_next_year/,2025-07-07,False,
other,,,,,"['lumpy income', 'Medicaid eligibility check', 'lost application', 'no health insurance']","When applying for marketplace plans, consider reporting a higher income for the current month to avoid being deemed eligible for Medicaid.",I was able to continue the application after adjusting my reported income.,positive,True,True,TX,1lhyww6,financialindependence,Beware the Medicaid eligibility check trap when applying on healthcare.gov!,212,https://reddit.com/r/financialindependence/comments/1lhyww6/beware_the_medicaid_eligibility_check_trap_when/,2025-06-22,True,
other,,,,,"['low bank balance', 'lack of parental support', 'tuition issues']",The post reflects on a past financial struggle and the journey to financial independence.,20 years later I'm sitting here with ~ 2M and a paid off house.,positive,True,False,,1m7m7i3,financialindependence,What was your lowest net worth as an independent adult?,198,https://reddit.com/r/financialindependence/comments/1m7m7i3/what_was_your_lowest_net_worth_as_an_independent/,2025-07-23,False,
layoff,,,,,[],Getting fired can be a humbling experience that encourages individuals to separate their identity from their job.,"It has been a year since the layoff, and the author reflects on the experience.",positive,True,False,,1ox1m3q,financialindependence,I Got FIREd 1 Year Ago - Year in Review,195,https://reddit.com/r/financialindependence/comments/1ox1m3q/i_got_fired_1_year_ago_year_in_review/,2025-11-14,True,
