problem_type,current_role,target_role,years_experience,industry,constraints,advice_summary,outcome,outcome_sentiment,has_outcome,salary_mentioned,location,post_id,subreddit,title,score,url,created_date,has_update,_error
burnout,software developer,,1.0,B2B EDI development,"['overwhelming workload', 'lack of documentation', 'time-sensitive troubleshooting', 'small team', 'intimidating environment']",The poster is seeking advice on whether to leave their current job for their mental health despite concerns about their future.,have an offer at another company but need to await clearance,mixed,True,False,,1sdlp07,cscareerquestions,Burnt out from dev work or just my current job?,19,https://reddit.com/r/cscareerquestions/comments/1sdlp07/burnt_out_from_dev_work_or_just_my_current_job/,2026-04-06,True,
job_search,Software Engineer,,4.0,Technology,"['un(der)employed for over a year', 'drained of money', 'lack of referrals', 'high competition for jobs', 'limited success with networking']","Apply early and often, constantly upskill, and be prepared for interviews. Utilize unemployment benefits if possible.",I still don’t have another job in the SWE field after being laid off.,negative,True,False,US,1rvacml,cscareerquestions,"I have 4 YOE and been un(der)employed for over a year. Here is everything I’ve experienced during my job search (tips, tricks, and what to expect)",16,https://reddit.com/r/cscareerquestions/comments/1rvacml/i_have_4_yoe_and_been_underemployed_for_over_a/,2026-03-16,True,
burnout,foreign contractor in a technical position,startup founder,13.0,technology,"['toxic work environment', 'job insecurity', 'need for client acquisition']","My advice for people in a similar situation is to go for it, especially if you have savings that will last you 6-24 months.",Currently focusing on my startup and finding new clients.,positive,True,True,,1ryw0ks,cscareerquestions,I quit my job,18,https://reddit.com/r/cscareerquestions/comments/1ryw0ks/i_quit_my_job/,2026-03-20,True,
job_search,DevOps Engineer,DevOps Engineer at Goldman Sachs,,Telecom,"['conflicted about accepting IBM offer', 'waiting for Goldman Sachs response', 'concern about burning bridges', 'timing of interview process']",The poster is seeking advice on whether to accept the IBM offer while waiting for a potential offer from Goldman Sachs.,The poster received an offer from IBM but is still in the interview process with Goldman Sachs.,mixed,True,False,,1s1rvvr,cscareerquestions,Received an offer for IBM but in the pipeline for Goldman Sachs,11,https://reddit.com/r/cscareerquestions/comments/1s1rvvr/received_an_offer_for_ibm_but_in_the_pipeline_for/,2026-03-23,True,
promotion,,senior engineer,,,"['hesitated to speak up', 'overthought what to say', 'struggled to articulate ideas clearly']","The post discusses the importance of communication skills over technical skills for career advancement, particularly in achieving a senior promotion.","Focusing more on communication made a much bigger difference than expected, especially in meetings and cross-team work.",positive,True,False,,1se3tzw,cscareerquestions,"at some point I realized communication was holding me back more than technical skill, anyone else experienced this?",12,https://reddit.com/r/cscareerquestions/comments/1se3tzw/at_some_point_i_realized_communication_was/,2026-04-06,False,
job_search,senior software engineer,,5.0,software,"['competitive pool', 'relative fit', 'close decision']",The user seeks advice on the commonality of receiving positive signals during interviews only to be rejected and the usefulness of feedback calls after such rejections.,Received a rejection email despite positive feedback and signals during the interview process.,negative,True,False,,1s88rqf,cscareerquestions,"Exceptional feedback and they were ""leaning toward an offer"" but still got rejected - is this common?",10,https://reddit.com/r/cscareerquestions/comments/1s88rqf/exceptional_feedback_and_they_were_leaning_toward/,2026-03-31,False,
promotion,senior analyst,,3.0,,"['increased workload for minimal pay increase', 'lack of management training', '24/7 on-call responsibilities', 'pressure to be always available', 'negative treatment from manager after declining promotion']",The poster seeks validation for their decision to decline a promotion that would significantly increase their workload without a corresponding increase in pay.,The poster feels treated differently by their manager after declining the promotion.,negative,True,True,,1qws17i,careerguidance,Turned down a promotion because it was 30% more work for 5% more pay. My manager called me 'unambitious.' Am I wrong for not wanting to sacrifice my entire life for a fancy title?,2665,https://reddit.com/r/careerguidance/comments/1qws17i/turned_down_a_promotion_because_it_was_30_more/,2026-02-05,True,
salary_negotiation,,,,,"['high cost of living in Boston', 'family of 6', 'bare minimum salary offered', 'awkwardness in salary negotiation', 'need for a higher salary to maintain standard of living']",The poster is seeking advice on how to communicate their salary needs to the CEO after being offered a low salary.,"I did ask for the $160k, and it didn’t work out. They are offering no more than $130k and so I’m going to have to pass.",negative,True,True,"Boston, MA",1n6tojh,careerguidance,"Turned down the job, but CEO reached out again asking for what I need?",2551,https://reddit.com/r/careerguidance/comments/1n6tojh/turned_down_the_job_but_ceo_reached_out_again/,2025-09-02,True,
workplace_conflict,,,,,"['HR already talked to her', 'cannot approach her directly', 'smell is strong', 'office layout far from bathrooms']","The user sought advice on how to handle a coworker's hygiene issue without directly confronting her or going to HR, but ultimately decided to report the issue.",The coworker was fired after HR received multiple complaints about the hygiene issue.,positive,True,False,,1n14s45,careerguidance,"My coworker smells like pee, any advice?",2073,https://reddit.com/r/careerguidance/comments/1n14s45/my_coworker_smells_like_pee_any_advice/,2025-08-27,True,
layoff,,,,,"['no severance', 'no legal obligation to pay severance', 'HR policy not documented', 'company cutback']","The overwhelming response is that the user owes the company nothing, especially without compensation.",The final check has cleared and the user asked for severance but was declined.,mixed,True,True,,1p7mqfr,careerguidance,"I was laid off on Monday via zoom, they asked me to write up a transition plan and sign separation docs (no severance). Should I?",1901,https://reddit.com/r/careerguidance/comments/1p7mqfr/i_was_laid_off_on_monday_via_zoom_they_asked_me/,2025-11-26,True,
promotion,,,,,"[""wife's chemo treatment"", 'need to be available to get her home', 'interview timing', 'concern about professionalism']",The poster is seeking advice on whether to disclose their wife's cancer during a promotion interview and how to handle the situation professionally.,HR moved the interview and I'll keep it to a family obligation if I'm asked.,positive,True,True,,1knb97v,careerguidance,Should I Tell Interviewer My Wife has Cancer?,1837,https://reddit.com/r/careerguidance/comments/1knb97v/should_i_tell_interviewer_my_wife_has_cancer/,2025-05-15,True,
career_switch,corporate lawyer,personal trainer and mountain leader,,legal,"['financial runway', 'job market changes due to AI', 'previous experience of career change', 'concerns for juniors in the profession']","The author emphasizes the importance of having a financial runway before making significant career changes, especially in light of rapid advancements in AI affecting job security.",returned to law after burning through savings,negative,True,False,,1s0lwyc,careerguidance,I'm a corporate lawyer watching AI eat my profession in real time. Should I be treating the next 2 years as the most important financial window of my career?,1734,https://reddit.com/r/careerguidance/comments/1s0lwyc/im_a_corporate_lawyer_watching_ai_eat_my/,2026-03-22,False,
other,hiring manager,,8.0,small company,"['reliance on resumes', 'ATS filtering', 'credential-focused hiring', 'poor retention', 'low offer acceptance rate']",Focus on the quality of conversations during interviews rather than solely on resumes and credentials to find better hires.,Our offer acceptance rate went way up. Our retention went way up.,positive,True,False,,1rjixi6,careerguidance,"Has anyone else noticed that the best hires they've made had the ""worst"" resumes?",1474,https://reddit.com/r/careerguidance/comments/1rjixi6/has_anyone_else_noticed_that_the_best_hires/,2026-03-03,False,
workplace_conflict,,,,,"['boss replaced me in a presentation', 'blamed me for it going poorly', 'black eye from an incident']",The user sought advice on how to handle a conflict with their boss after being replaced in a presentation and blamed for its failure.,The user set up a meeting with their boss and HR to discuss the situation and also reached out to the CEO to offer assistance.,mixed,True,False,,1k11v0w,careerguidance,Update: Boss replaced me in a presentation then blamed me for it going poorly. How should I handle this?,1389,https://reddit.com/r/careerguidance/comments/1k11v0w/update_boss_replaced_me_in_a_presentation_then/,2025-04-17,True,
workplace_conflict,,,,,"['illegal interview questions', 'negative past experiences', 'unhealthy workplace culture']","The consensus is that the workplace culture at the firm is unhealthy and not a desirable environment, with suggestions for handling uncomfortable questions.",The interviewer used personal information against me during the hiring process.,negative,True,False,,1kgfqla,careerguidance,How to professionally decline an inappropriate or illegal question during an interview?,1386,https://reddit.com/r/careerguidance/comments/1kgfqla/how_to_professionally_decline_an_inappropriate_or/,2025-05-06,True,
career_switch,data analyst,,4.0,,"['back issues prevent manual labor', 'dyslexia or focus issues', 'no trade skills', 'upcoming baby limits low salary options', 'market for performing is small']","The poster is seeking advice on alternative career paths for their husband, who is struggling in his current role as a data analyst and has various limitations.",The poster will share suggestions with her husband but is unsure about the diagnostic process for ADHD in their country.,mixed,True,False,Central European country,1qof56h,careerguidance,Husband chose a too-difficult career. What now?,1344,https://reddit.com/r/careerguidance/comments/1qof56h/husband_chose_a_toodifficult_career_what_now/,2026-01-27,True,
job_search,,,10.0,corporate,"['hostile work environment', 'put on a PIP', 'limited job replies', 'overqualified for jobs', 'low pay offers']",The poster is seeking advice on how to approach their job search after being let go and feeling discouraged.,The poster has applied to approximately 70 job postings and received 2 replies.,negative,True,False,Bay Area,1mc9n60,careerguidance,Wtf is happening in the job market right now?,1181,https://reddit.com/r/careerguidance/comments/1mc9n60/wtf_is_happening_in_the_job_market_right_now/,2025-07-29,True,
layoff,bookkeeper,,,childcare,"['job elimination', 'lack of training for replacement', ""director's lack of understanding of job responsibilities"", 'refusal of previous trainer to train others', 'potential instability of the center']","The poster is seeking validation for their decision to resign without training their replacement, feeling disposable in their role.","The poster turned in their resignation, and the director reacted emotionally. They received a text asking for help shortly after leaving.",mixed,True,False,,1pij57v,careerguidance,AITA for leaving my job without training my replacement?,1151,https://reddit.com/r/careerguidance/comments/1pij57v/aita_for_leaving_my_job_without_training_my/,2025-12-09,True,
job_search,,,,,"['living paycheck to paycheck', 'lack of supervision hours for licensure', 'not interested in apprenticeship program']","The main advice was to ask the old job for the position back, which the user did successfully.","I took the advice of just asking my old job for my position back, and they gave it to me.",mixed,True,False,,1kk14g8,careerguidance,Company rescinded offer after I gave current job my two weeks. What should I do?,1053,https://reddit.com/r/careerguidance/comments/1kk14g8/company_rescinded_offer_after_i_gave_current_job/,2025-05-11,True,
salary_negotiation,,,,,"['HR policy does not explicitly state employment on payout date for bonus', 'Variable pay is not guaranteed or promised', 'Worried about reputational repercussions', 'Concern about burning bridges long-term']","The user is seeking advice on whether to resign on the day they receive their bonus or to give a traditional two-week notice, weighing the importance of the bonus against potential reputational risks.",new company said they could not move my start date,negative,True,True,,1rdz2e2,careerguidance,Should I resign on the day I get my bonus and give a one-day notice?,968,https://reddit.com/r/careerguidance/comments/1rdz2e2/should_i_resign_on_the_day_i_get_my_bonus_and/,2026-02-25,True,
layoff,data and system operations,,1.0,,"['team member at risk of layoff', 'no one else has training or experience', 'lower pay compared to team member', 'no multi-days off', 'concerns about job merging']",The poster is seeking options and advice on how to handle the situation before a potential layoff occurs.,"I got moved to a different department, with nice promotion and a 22% raise. And my previous role was merged.",positive,True,True,,1q1r97d,careerguidance,"Is there a good way to let upper leadership know if my team member is part of an upcoming layoff, I will resign that same day?",925,https://reddit.com/r/careerguidance/comments/1q1r97d/is_there_a_good_way_to_let_upper_leadership_know/,2026-01-02,True,
other,software developer,medical program specialized in cancer,,technology,"['father is dying', 'need compassionate leave', 'competitive medical program', 'full-time job while studying']",The user sought advice on whether they could quit immediately due to their father's illness and received support for taking compassionate leave.,The user successfully arranged compassionate leave and plans to quit their job to pursue a medical program.,positive,True,False,Asia,1kg7waa,careerguidance,"Update for this post ""Can I quit immediately without 2 weeks notice because my dad is dying?""",911,https://reddit.com/r/careerguidance/comments/1kg7waa/update_for_this_post_can_i_quit_immediately/,2025-05-06,True,
job_search,,,,,"['uncertain deals', 'job market is tough', 'waiting for better offers', 'laid off', 'unemployed']",The user is seeking advice on whether to accept a lower offer as a safety net or wait for potentially better offers.,"Accepted the offer and got $110k, while still pursuing other opportunities.",positive,True,True,,1qd1wm1,careerguidance,"Laid off. Should I accept a ""safe"" $106k offer now, or hold out for pending interviews which pay better ($150k-$165k)?",864,https://reddit.com/r/careerguidance/comments/1qd1wm1/laid_off_should_i_accept_a_safe_106k_offer_now_or/,2026-01-14,True,
workplace_conflict,,,,,"['coworker undermines work', 'high turnover rate', 'coworker has seniority', 'manager unaware of conflict', 'concern about burning bridges']",The poster is seeking advice on whether to disclose the coworker's behavior to their manager while considering a counteroffer.,"The poster told their manager about the coworker being a big reason for leaving, and the manager acknowledged the tension and scheduled a follow-up meeting.",positive,True,True,,1kizc6k,careerguidance,Should I tell my boss I’m leaving because of my coworker?,838,https://reddit.com/r/careerguidance/comments/1kizc6k/should_i_tell_my_boss_im_leaving_because_of_my/,2025-05-10,True,
workplace_conflict,intern,,,,"['lack of hygiene', 'humiliation', 'mental health concerns', 'no other job lined up']",The poster is seeking advice on whether quitting is the right option after receiving feedback about their hygiene from their manager.,The manager congratulated the poster for getting the role and mentioned that proceedings would start.,mixed,True,False,,1kymium,careerguidance,"My manager told me I smell bad and everyone talks about it, then hired me. I literally don't know how to proceed and am wondering if quitting is the right option?",776,https://reddit.com/r/careerguidance/comments/1kymium/my_manager_told_me_i_smell_bad_and_everyone_talks/,2025-05-29,True,
job_search,,government job,,,"['terminated from last job', 'ghosted by previous employer', 'need to explain termination to recruiters']",The user is seeking guidance on how to professionally explain their termination to government job recruiters after being fired shortly after giving notice.,User is on their third round of interviews for the government position and is preparing to discuss the reason for termination.,unknown,True,False,,1r0zkdl,careerguidance,Employer terminated me 3 days after I put in my 2-week notice. What do I tell future employers?,766,https://reddit.com/r/careerguidance/comments/1r0zkdl/employer_terminated_me_3_days_after_i_put_in_my/,2026-02-10,True,
workplace_conflict,employee in construction company,,5.0,construction,"['conservative work environment', 'religious pressure', 'unprofessional behavior from chaplain', 'fear of repercussions']",The poster is seeking advice on how to handle a conflict with a chaplain visiting the office and expressing their discomfort with the situation.,"The direct supervisor did not address the issue, and the conversation with the boss's boss was respectful.",positive,True,False,,1k0ph18,careerguidance,How much in trouble am I in? What should I say tomorrow?,622,https://reddit.com/r/careerguidance/comments/1k0ph18/how_much_in_trouble_am_i_in_what_should_i_say/,2025-04-16,True,
job_search,communications,,,communications,"['no interviews', 'no rejection emails', 'customized applications', 'applicant tracking systems']",The post seeks advice on improving job application success and whether AI tools for keyword optimization could help.,She received overwhelming support and helpful advice from the community.,positive,True,False,NYC and NJ,1k1hd83,careerguidance,Why is my wife not getting interviews despite customizing each application and resume?,584,https://reddit.com/r/careerguidance/comments/1k1hd83/why_is_my_wife_not_getting_interviews_despite/,2025-04-17,True,
workplace_conflict,,,,,"['facing a complaint against me', 'investigation by area manager', 'potential job loss', 'stress and anxiety', 'upcoming remote work transition']",The poster is seeking clarity on the investigation process and whether they might be fired over a false accusation.,HR conducted interviews and indicated that no one is backing up the complaint against the poster.,mixed,True,False,,1lmkebo,careerguidance,I have an hr case open against me. Am I getting fired?,584,https://reddit.com/r/careerguidance/comments/1lmkebo/i_have_an_hr_case_open_against_me_am_i_getting/,2025-06-28,True,
workplace_conflict,full time employee,,1.0,,"['coworkers pranking', 'bullying about hygiene', 'embarrassment', 'small team dynamics']","The poster is seeking advice on whether to quit after discovering that coworkers were pranking them about their hygiene, despite being a good employee.",The manager gave the poster a week to reconsider their decision to quit.,mixed,True,False,,1njuztn,careerguidance,"Discovered that coworkers have been ""pranking"" me and now I don't know if I should still quit?",563,https://reddit.com/r/careerguidance/comments/1njuztn/discovered_that_coworkers_have_been_pranking_me/,2025-09-18,False,
salary_negotiation,Consultant,Senior Consultant,5.0,data analytics,"['Manager is too overworked to develop me', 'Market concerns with small firm', 'Heavy AWS focus', 'Professional services sensitivity', '5 years is a long time']",The poster is seeking advice on whether to accept a counteroffer from their current employer or to move to a new company that offers better compensation and benefits.,The poster signed the offer letter for the new company but is considering the counteroffer.,mixed,True,True,,1oq0la8,careerguidance,"Gave notice, immediate counter. Do I take it?",564,https://reddit.com/r/careerguidance/comments/1oq0la8/gave_notice_immediate_counter_do_i_take_it/,2025-11-06,False,
career_switch,certified nurse assistant,licensed vocational nurse,,healthcare,"['agreed start date not honored', 'pressure to start immediately', 'lack of communication from management']",The poster is seeking validation for their decision to withdraw from a job offer due to the company not honoring their agreed start date and is considering whether they should have negotiated further or contacted HR.,The poster decided to withdraw their offer to work for the company.,mixed,True,False,,1k366jr,careerguidance,Did I make the right decion to quit my new job for not honoring my agreed start date?,558,https://reddit.com/r/careerguidance/comments/1k366jr/did_i_make_the_right_decion_to_quit_my_new_job/,2025-04-19,True,
job_search,,,,,"['privacy concerns', 'lack of feedback', 'stressful interview process']","The post discusses the unfairness of companies recording interviews while candidates are not allowed to do the same, suggesting that candidates should be able to record for self-improvement.",The author recorded the interview anyway despite the recruiter's objections.,mixed,True,False,EU,1rg83bz,careerguidance,Companies record every interview they do but freak out when YOU ask to do the same — is this not insane to anyone else?,544,https://reddit.com/r/careerguidance/comments/1rg83bz/companies_record_every_interview_they_do_but/,2026-02-27,True,
workplace_conflict,leader,,0.0,medium size company,"['toxic workplace culture', 'high pressure', 'unapproachable manager', 'extreme anxiety about asking questions', 'team instability']",The post seeks advice on whether leaving a toxic job will damage the author's reputation.,The author accepted a job offer for something that felt like a better fit culture-wise.,positive,True,False,,1qz79s7,careerguidance,"I quit a toxic job after three months and my cold, unapproachable boss broke down crying. Is this damaging my reputation?",527,https://reddit.com/r/careerguidance/comments/1qz79s7/i_quit_a_toxic_job_after_three_months_and_my_cold/,2026-02-08,True,
layoff,,,,supplement,"['medical leave for mental health', 'illegal demotion', 'treated as incapable', 'laid off', 'dog surgery expenses']","The user is seeking advice on how to handle an upcoming meeting with their boss and higher management, expressing concern about their job security and treatment at work.","They were laid off due to the company going in a different direction, but received more severance pay than legally required.",mixed,True,False,,1l9odqk,careerguidance,Boss and Bosses boss request meeting. What do I do?,499,https://reddit.com/r/careerguidance/comments/1l9odqk/boss_and_bosses_boss_request_meeting_what_do_i_do/,2025-06-12,True,
layoff,data quality analyst,,8.0,banking,"['low savings', 'lack of transferable skills', 'mental health issues', 'potential need to move', 'supporting a sick spouse']",The poster is seeking guidance on how to cope with losing their job and the associated financial and emotional challenges.,Faster responses than I expected.,positive,True,False,,1nryeoe,careerguidance,"Found out I'll be losing my job at 33. Depression and little savings, how do I keep my life from falling apart?",492,https://reddit.com/r/careerguidance/comments/1nryeoe/found_out_ill_be_losing_my_job_at_33_depression/,2025-09-27,True,
layoff,sales representative,,,corporate sales,"['high turnover in sales department', 'questionable leadership decisions', 'toxic work culture', 'high activity requirements', 'sick with no sick time']","The poster is seeking advice on how to cope with being fired after making a poor decision under pressure, despite being a top performer.",The poster was fired during a meeting with their VP.,negative,True,True,,1prlne4,careerguidance,Got fired for something embarrassing and totally my fault.. how do I cope?,471,https://reddit.com/r/careerguidance/comments/1prlne4/got_fired_for_something_embarrassing_and_totally/,2025-12-20,True,
workplace_conflict,,,13.0,multinational,"['informal blacklisting', 'political obstacles', 'repeated rejections', 'powerful stakeholders', 'demotivating situation']",The poster is seeking advice on how to address an informal blacklisting situation within their company and whether it's common in large corporations.,I still managed to make the international move. I am quite happy since then in the new country.,positive,True,True,,1qi05sr,careerguidance,I think I’m unofficially blacklisted inside my company – what can I do?,466,https://reddit.com/r/careerguidance/comments/1qi05sr/i_think_im_unofficially_blacklisted_inside_my/,2026-01-20,False,
layoff,mid-senior level,,2.0,,"['recently finished a PIP', ""training wasn't good"", 'fast-paced environment', 'limited opportunities due to economy']",The poster is seeking advice on whether the meeting invite is a red flag for potential firing.,I WAS LET GO,negative,True,False,,1p5fhmk,careerguidance,Weird meeting invite—should I be worried?,456,https://reddit.com/r/careerguidance/comments/1p5fhmk/weird_meeting_inviteshould_i_be_worried/,2025-11-24,True,
