problem_type,current_role,target_role,years_experience,industry,constraints,advice_summary,outcome,outcome_sentiment,has_outcome,salary_mentioned,location,post_id,subreddit,title,score,url,created_date,has_update,_error
layoff,IT Auditor,cybersecurity,2.0,IT,"['put on a PIP', 'small team', 'sudden change in expectations', 'lack of support', 'soft skills development needed']",The poster is seeking support and advice on how to navigate their impending job loss and transition into a new role.,Got my desk belongings in a box.,negative,True,False,,1sf7a9u,ITCareerQuestions,"100% getting fired tomorrow, PIP-related",333,https://reddit.com/r/ITCareerQuestions/comments/1sf7a9u/100_getting_fired_tomorrow_piprelated/,2026-04-07,True,
promotion,Sr. Engineer,Director,,IT,"['interpersonal skills', 'communication issues', 'technical expertise not enough', 'perception by others']",Self-reflection is crucial for career advancement; technical skills alone may not suffice for promotions. It's important to improve interpersonal skills and adapt to different work environments.,The author was hired for the Director role instead of the stellar Sr. Engineer.,mixed,True,False,,1ke9dqg,ITCareerQuestions,"Word of Advice: Sometimes, it's you.",324,https://reddit.com/r/ITCareerQuestions/comments/1ke9dqg/word_of_advice_sometimes_its_you/,2025-05-04,False,
job_search,Application Support,,,IT,"['No degree', 'Only half of A+ completed', 'People going into debt for degrees']",Focus on building projects and gaining experience rather than just obtaining certifications. Be able to articulate your problem-solving process during interviews.,Got hired in IT with no degree and only one half of the A+ done.,positive,True,False,,1onfh2b,ITCareerQuestions,Got An IT Job With No Degree,315,https://reddit.com/r/ITCareerQuestions/comments/1onfh2b/got_an_it_job_with_no_degree/,2025-11-03,True,
layoff,IT support,,3.0,IT,"['poor performance', 'personal stress', 'difficult year', 'on-call shifts', 'new manager']",The poster reflects on their experience and sees being let go as a potential opportunity for growth despite the challenges faced.,The poster is choosing to see the layoff as a blessing in disguise.,positive,True,False,,1ktnlmy,ITCareerQuestions,"I was let go from my IT support job today after 3 years and honestly, I think it might be the best thing for me.",297,https://reddit.com/r/ITCareerQuestions/comments/1ktnlmy/i_was_let_go_from_my_it_support_job_today_after_3/,2025-05-23,True,
job_search,,onsite helpdesk/desktop tech,,IT,"['many applicants disqualified due to location', 'lack of relevant experience', 'applicants not wanting full time on site', 'no shows for interviews', 'poor interview performance']","Don't be discouraged by the number of applicants; if your resume aligns with the job posting and you can communicate effectively, apply. Avoid exaggerating your qualifications.","5 candidates made it to the interview stage, but many had poor performance.",mixed,True,False,,1lk9lmu,ITCareerQuestions,Tales from a hiring manager,292,https://reddit.com/r/ITCareerQuestions/comments/1lk9lmu/tales_from_a_hiring_manager/,2025-06-25,True,
promotion,helpdesk,network team,6.0,IT,"['introverted personality', 'lack of small talk skills', 'perceived lack of opportunities']",The user reflects on the importance of being more social and making opportunities for themselves in their career.,The user plans to look for more opportunities elsewhere and practice being more outgoing.,positive,True,False,,1m7g48f,ITCareerQuestions,Can you not be an introvert in IT anymore?,292,https://reddit.com/r/ITCareerQuestions/comments/1m7g48f/can_you_not_be_an_introvert_in_it_anymore/,2025-07-23,True,
career_switch,help desk,network engineer or admin,,IT,"['lack of mentorship', 'feeling unprepared', 'need for proven work experience']",The poster is seeking advice on whether it's realistic to transition from help desk to a network engineer role with their current qualifications and experience.,I'll get to where I'm going eventually.,positive,True,False,,1nul52w,ITCareerQuestions,Harsh reality of IT in today’s market.,279,https://reddit.com/r/ITCareerQuestions/comments/1nul52w/harsh_reality_of_it_in_todays_market/,2025-09-30,True,
job_search,IT,,5.0,IT,"['laid off unexpectedly', 'crappy severance', 'initially faced rejections', 'ghosting from employers', 'tight acceptance window for offers']",The poster learned to actively apply for new roles and utilize LinkedIn effectively to find new job listings. They also realized the importance of not becoming complacent in their career.,The poster accepted a job offer that was more than their previous salary after a series of interviews.,positive,True,True,east coast,1r400b0,ITCareerQuestions,"Got laid off in mid Jan, just accepted an offer!",279,https://reddit.com/r/ITCareerQuestions/comments/1r400b0/got_laid_off_in_mid_jan_just_accepted_an_offer/,2026-02-13,True,
job_search,Lead Help Desk Analyst,Systems Administrator,7.0,IT,"['hardly ever heard back from applications', 'couldn’t break past $65,000/yr', 'felt hopeless and stuck']",Keep applying and always check for internal opportunities. Don't lose hope!,I officially got promoted to a Systems Administrator last month and I now make just shy of 6 figures.,positive,True,True,,1m3jfup,ITCareerQuestions,"UPDATE: Have a Degree, Certs, and Experience. Can't Land Higher Paying Job. Losing Hope.",262,https://reddit.com/r/ITCareerQuestions/comments/1m3jfup/update_have_a_degree_certs_and_experience_cant/,2025-07-19,True,
career_switch,M365 Administrator,,2.0,IT,"['no certifications', 'high cost of living in Chicago', 'difficult to get out of support roles', 'technical debt in current role', 'stressful work environment at MSP']",The author encourages new entrants to the IT field to work at an MSP for learning opportunities despite the chaos. They emphasize the merit-based nature of the industry.,Currently making 105k with a 5% bonus and optimistic about future growth.,positive,True,True,Chicago,1rmlckb,ITCareerQuestions,100k in 5 years. Wanted to make an encouraging post,255,https://reddit.com/r/ITCareerQuestions/comments/1rmlckb/100k_in_5_years_wanted_to_make_an_encouraging_post/,2026-03-06,True,
workplace_conflict,help desk technician,,0.0,IT,"['limited training', 'treated poorly by colleagues', ""assumed to know everything about predecessor's work"", 'overwhelmed at times', 'lack of support from coworkers']",The post serves as a venting outlet about the challenges faced in the workplace due to being new and overwhelmed.,I was left alone for a week and did just fine.,positive,True,False,,1n8nvwg,ITCareerQuestions,Not a question but man you really have to have thick skin in this industry,230,https://reddit.com/r/ITCareerQuestions/comments/1n8nvwg/not_a_question_but_man_you_really_have_to_have/,2025-09-04,True,
education_decision,,,,,"['proctor issues', 'finding a vacant room']",The author recommends using Exam Compass for studying and emphasizes the importance of completing all quizzes.,The author passed the CompTIA A+ certification exams.,positive,True,False,,1m98k8c,ITCareerQuestions,I am CompTIA A+ Certified!!!!,220,https://reddit.com/r/ITCareerQuestions/comments/1m98k8c/i_am_comptia_a_certified/,2025-07-25,False,
other,junior network administrator,,2.0,IT,['no degree'],Stay intentional and don't give up on your career goals in IT.,Hired as a junior network administrator after working at the help desk.,positive,True,False,,1l2bi00,ITCareerQuestions,Don’t give up guys it’s possible in IT,220,https://reddit.com/r/ITCareerQuestions/comments/1l2bi00/dont_give_up_guys_its_possible_in_it/,2025-06-03,True,
job_search,Sys admin,,6.0,IT,"['picky about job applications', 'limited job pool for desired salary', 'competition is immense']",The poster is seeking feedback on their job search strategy and whether they are doing something wrong given the current market conditions.,The poster received 1 offer but did not accept it due to insufficient pay increase.,mixed,True,True,,1k0vei6,ITCareerQuestions,Is it just me or the market is really that bad?,205,https://reddit.com/r/ITCareerQuestions/comments/1k0vei6/is_it_just_me_or_the_market_is_really_that_bad/,2025-04-16,False,
career_switch,1st line broadband + telephony support,Security Operations Analyst,,IT,"['no degree', 'no certs', 'limited formal education', 'low initial salary']","Keep learning, asking questions, and take chances when opportunities arise, as you never know who might be willing to give you a shot.",Landed a role in cybersecurity as a Security Operations Analyst.,positive,True,False,,1nvjixe,ITCareerQuestions,Got a role in cybersecurity with no certs and no degree!,196,https://reddit.com/r/ITCareerQuestions/comments/1nvjixe/got_a_role_in_cybersecurity_with_no_certs_and_no/,2025-10-01,True,
job_search,,,,,[],The user is seeking advice on additional certifications that could help them secure a job in IT.,"The user is now certified in CompTIA A+, Network+, Security+, and CySA+.",positive,True,False,,1kgygmx,ITCareerQuestions,Update- can’t pass A+… well here we are,185,https://reddit.com/r/ITCareerQuestions/comments/1kgygmx/update_cant_pass_a_well_here_we_are/,2025-05-07,False,
job_search,,,8.0,,"['bad recruiting agency experience', 'low salary expectations', 'high cost of living area', 'feeling humiliated', 'lack of guidance']",Job seekers should be aware that not all recruiters have their best interests at heart and to stay strong despite setbacks.,"Today, I make over three times that number.",positive,True,True,,1qof014,ITCareerQuestions,Reminder that there are bad recruiting agencies out there,185,https://reddit.com/r/ITCareerQuestions/comments/1qof014/reminder_that_there_are_bad_recruiting_agencies/,2026-01-27,True,
job_search,SOC Analyst,,1.0,IT,"['tough job market', 'high number of applications', 'need for practical skills']","Keep pushing and learning, and focus on practical labs/projects and certifications to improve your chances in IT.",Got a higher paying SOC role that I was interviewing for at the same time as this job. Background check just cleared and I start in a few weeks.,positive,True,True,,1mk225t,ITCareerQuestions,"Update: Just landed a full time offer as a SOC Analyst making 90k, it is possible in this market.",187,https://reddit.com/r/ITCareerQuestions/comments/1mk225t/update_just_landed_a_full_time_offer_as_a_soc/,2025-08-07,True,
layoff,senior dev,,20.0,IT,"['fired for unclear reasons', 'fired after short tenure', 'performance metrics not met', 'recent illness (COVID)', 'age concerns']",The poster is seeking understanding of the layoffs and how to prevent future occurrences.,He was fired after 8 weeks at the new job.,negative,True,False,,1ry6god,ITCareerQuestions,Husband fired 2x in 1 year for metrics,184,https://reddit.com/r/ITCareerQuestions/comments/1ry6god/husband_fired_2x_in_1_year_for_metrics/,2026-03-19,False,
job_search,intern,entry-level help-desk,0.0,IT,"['rejection from Geek Squad', 'lack of experience', 'difficulty finding entry-level positions']",The poster is seeking advice on how to break into the IT field and secure entry-level help-desk positions.,rejection email from Geek Squad,negative,True,False,,1lfe5mq,ITCareerQuestions,"Two college degrees (BA and AAS) A+, Sec+, rejected from Geek Squad",181,https://reddit.com/r/ITCareerQuestions/comments/1lfe5mq/two_college_degrees_ba_and_aas_a_sec_rejected/,2025-06-19,False,
job_search,SOC Analyst,,1.0,IT,"['tough job market', 'high number of applications', 'need for practical skills']","Keep pushing and learning, and focus on practical labs/projects and certifications to improve your chances in IT.",Got a higher paying SOC role that I was interviewing for at the same time as this job. Background check just cleared and I start in a few weeks.,positive,True,True,,1kjgn40,ITCareerQuestions,"Just landed a full time offer as a SOC Analyst, it is possible in this market.",179,https://reddit.com/r/ITCareerQuestions/comments/1kjgn40/just_landed_a_full_time_offer_as_a_soc_analyst_it/,2025-05-10,True,
job_search,,Computer Networking Systems,,IT,"['9 months of job searching', 'submitted over 500 applications', 'only landed 5 interviews', 'internal restructuring', 'personal family health issues']","The post expresses a deep sense of exhaustion and frustration with the job market, seeking support and understanding.",Did not get the job due to internal restructuring.,negative,True,False,,1l9ecz6,ITCareerQuestions,Finally got a job after 9 months,177,https://reddit.com/r/ITCareerQuestions/comments/1l9ecz6/finally_got_a_job_after_9_months/,2025-06-12,True,
job_search,low paying job on the corporate side,tier one support role,,IT,"['no previous experience', ""didn't finish college""]",Don't give up. You can do this.,I got hired internally.,positive,True,False,,1ooop4o,ITCareerQuestions,Got my first IT Job with no previous experience,177,https://reddit.com/r/ITCareerQuestions/comments/1ooop4o/got_my_first_it_job_with_no_previous_experience/,2025-11-05,False,
job_search,tier 1 help desk tech,,3.0,IT,"['little to no experience', 'age perception', 'high rejection rate', 'low initial salary expectations']",It's possible to get an entry-level IT job with little experience by obtaining certifications and being proactive in learning. Keep applying and temper your expectations regarding salary and rejections.,I now work at a billion-dollar company and make 60k a year.,positive,True,True,Ohio,1nw54b1,ITCareerQuestions,"Yes, it is possible to get an IT job with little/no experience and a cert.",164,https://reddit.com/r/ITCareerQuestions/comments/1nw54b1/yes_it_is_possible_to_get_an_it_job_with_littleno/,2025-10-02,False,
other,sys admin,,10.0,IT,"['difficulty finding helpdesk jobs', 'need for certifications', 'competitive job market', 'rapid changes in technology']","Focus on gaining experience in various IT roles, specialize in areas of interest, and continuously build skills to stay competitive in the industry.",Suggests not staying at a job too long to ensure growth and relevance.,positive,True,False,,1qra5rm,ITCareerQuestions,"10 years in the industry, here is some advice",167,https://reddit.com/r/ITCareerQuestions/comments/1qra5rm/10_years_in_the_industry_here_is_some_advice/,2026-01-30,True,
layoff,Help Desk,,2.0,IT,"['unrealistic metrics', 'lack of support from leadership', 'limited access to perform tasks', 'poor training opportunities', 'no recognition for achievements']",The post expresses frustration over being fired shortly after being placed on a PIP and highlights the challenges faced in the role.,I was fired four days into my PIP.,negative,True,False,,1qeeble,ITCareerQuestions,Fired 4 Days Into My PIP. Just Venting.,166,https://reddit.com/r/ITCareerQuestions/comments/1qeeble/fired_4_days_into_my_pip_just_venting/,2026-01-16,True,
career_switch,IT professional,Construction/Design project manager,,IT,"['bad working environment', ""supervisor's bias against women"", 'need to train replacement']",The poster is seeking to connect with others who have left IT and is considering consulting depending on the demands of their new job.,The poster has given their notice and will start a new job on August 18th.,positive,True,False,,1lwhnf1,ITCareerQuestions,Well I did it. Anyone else left IT recently?,159,https://reddit.com/r/ITCareerQuestions/comments/1lwhnf1/well_i_did_it_anyone_else_left_it_recently/,2025-07-10,True,
job_search,server technician,,,IT,"['lack of certifications', 'limited software knowledge', 'concerns about job expectations']","The user is seeking advice on what to expect in their new role as a server technician, especially regarding job expectations and responsibilities.",The user accepted the job despite concerns about their skills.,positive,True,False,Texas,1rluire,ITCareerQuestions,I've accepted a job as a server technician for Nvidia AI servers,155,https://reddit.com/r/ITCareerQuestions/comments/1rluire/ive_accepted_a_job_as_a_server_technician_for/,2026-03-05,False,
career_switch,internal IT auditor,IT risk and governance,15.0,financial,"['niche career', 'early years of starting at a Big 4', 'need for soft skills improvement', 'high workload', 'competition for traditional roles']",Consider looking into IT audit and IT risk roles as they are relevant and can lead to promotions every 1 to 3 years. An audit background is beneficial for moving into IT risk and governance.,I switched over to IT risk and governance for a few more years and am about to progress into a leadership role.,positive,True,False,,1pt94bs,ITCareerQuestions,Tip to those seeking IT career direction/inspiration: please consider IT Audit and IT Risk.,154,https://reddit.com/r/ITCareerQuestions/comments/1pt94bs/tip_to_those_seeking_it_career/,2025-12-22,False,
job_search,data center integration tech,,0.0,IT,"['zero experience', 'low pay']","Apply to as many jobs as you can, use your existing network, and don't avoid lower-paying jobs when starting out.",I got an offer for a temporary data center integration tech at a large company.,positive,True,False,,1qeh4ib,ITCareerQuestions,"I got a job! Passed Comptia a+, zero experience",152,https://reddit.com/r/ITCareerQuestions/comments/1qeh4ib/i_got_a_job_passed_comptia_a_zero_experience/,2026-01-16,True,
job_search,Helpdesk,,4.0,IT,"['quit without something lined up', 'previous job was stressful', 'micromanagement', 'lack of training']",The user is seeking advice on next steps in their job search after quitting their job without a backup plan.,User has about 4 years of savings and no debt.,positive,True,False,,1s9kaca,ITCareerQuestions,I did what everyone warned me not to do...quit without something lined up,151,https://reddit.com/r/ITCareerQuestions/comments/1s9kaca/i_did_what_everyone_warned_me_not_to_doquit/,2026-04-01,True,
job_search,Customer Service Network Technician,,5.0,IT,"[""lack of Bachelor's degree"", 'lack of 4-5 years of experience', 'GSA compliance issues']",The user is seeking advice on how to move forward after losing a job offer due to compliance issues.,The job offer was rescinded due to GSA compliance.,negative,True,False,Philadelphia,1sfycr8,ITCareerQuestions,I got a job did onboarding and lost it before i started due to GSA compliance :(,146,https://reddit.com/r/ITCareerQuestions/comments/1sfycr8/i_got_a_job_did_onboarding_and_lost_it_before_i/,2026-04-08,True,
education_decision,,,,IT,"['shrinking job markets', 'layoffs', 'bleak outlook on the IT industry', 'packed schedule']",The user is seeking advice on how to navigate a challenging job market as they approach graduation and plans to focus on networking while excelling in college.,"The user plans to create a game plan, speak with their professor, and network in their area.",positive,True,False,,1okyld4,ITCareerQuestions,So am I fucked? IT industry seemingly imploding when I'm close to graduating.,139,https://reddit.com/r/ITCareerQuestions/comments/1okyld4/so_am_i_fucked_it_industry_seemingly_imploding/,2025-10-31,True,
other,AI product management,,25.0,IT,[],The post is an invitation for others to ask questions about the author's extensive career in IT.,The author has exited their previous role and is focusing on a new startup.,positive,True,False,,1melb2z,ITCareerQuestions,25 years in IT support and services - ask me anything,137,https://reddit.com/r/ITCareerQuestions/comments/1melb2z/25_years_in_it_support_and_services_ask_me/,2025-08-01,True,
job_search,,IT support,,IT,"['lack of real-world experience', 'difficulty with scenario questions', 'feeling unprepared despite certifications', 'limited interview success']","The main advice is to focus on practical thinking and scenario-based preparation for interviews, as theoretical knowledge alone is not sufficient.",Started using Verve AI for mock interviews to practice scenario questions and is improving in thinking like actual IT support.,positive,True,False,,1migcvl,ITCareerQuestions,"Have A+, Net+, Sec+ but keep bombing technical interviews - what am I doing wrong?",137,https://reddit.com/r/ITCareerQuestions/comments/1migcvl/have_a_net_sec_but_keep_bombing_technical/,2025-08-05,True,
job_search,IT,IT,0.0,IT,[],Don't overthink it and stress yourself out; things are often better than they seem.,My boss was super supportive and happy for me and said I’m welcomed back if things don’t work out.,positive,True,True,,1oel8qu,ITCareerQuestions,How do I tell my boss I’m putting my two weeks in?,131,https://reddit.com/r/ITCareerQuestions/comments/1oel8qu/how_do_i_tell_my_boss_im_putting_my_two_weeks_in/,2025-10-24,True,
career_switch,IT position,IT Analyst,8.0,IT,"['limited salary growth', 'lack of career advancement opportunities', 'emotional attachment to current company', 'uncertainty about new role']","The poster is seeking advice on whether leaving their current job for a new IT Analyst position is the right decision, given their emotional ties and limited salary increase.",The poster received a job offer for the IT Analyst position.,mixed,True,True,,1o72bij,ITCareerQuestions,Got a job offer for an IT Analyst  but not sure if I'm making the right choice.,134,https://reddit.com/r/ITCareerQuestions/comments/1o72bij/got_a_job_offer_for_an_it_analyst_but_not_sure_if/,2025-10-15,True,
job_search,,,,,[],The post reflects the effort put into job searching and the eventual success in receiving a better offer.,Received a confirmed offer for 60K/yr.,positive,True,True,,1jzevy3,ITCareerQuestions,Received offer for better job… It’s finally paying off,132,https://reddit.com/r/ITCareerQuestions/comments/1jzevy3/received_offer_for_better_job_its_finally_paying/,2025-04-15,False,
career_switch,IT networking,Design Construction project management,10.0,IT,"['previous horrible supervisor', 'completely new at this job']","Skills from IT can translate to other fields, and it's okay to start anew in a different career.",I've been on my new job for 2 weeks and I absolutely love it.,positive,True,False,,1n29hfl,ITCareerQuestions,Update on change of career.,130,https://reddit.com/r/ITCareerQuestions/comments/1n29hfl/update_on_change_of_career/,2025-08-28,True,
career_switch,helpdesk employee,,10.0,IT,"['no formal education in the field', 'high workload', 'dread going to work', 'family life constraints', 'layoffs in organization']",The poster is seeking advice on how to advance in their IT career despite feeling overwhelmed and constrained by their current situation.,The poster was laid off from a previous job and took the first available position at the hospital helpdesk.,mixed,True,False,Memphis TN,1m70ib9,ITCareerQuestions,37 year old helpdesk employee...now what?,124,https://reddit.com/r/ITCareerQuestions/comments/1m70ib9/37_year_old_helpdesk_employeenow_what/,2025-07-23,True,
career_switch,IT Technician,,3.0,IT,"['current job refuses to promote pay', 'offer does not meet average cost of living', 'extra commuting required']","The poster is considering whether to accept a lower-paying job or negotiate for a better salary, given their current job situation and upcoming graduation.",Had to rescind my acceptance due to undisclosed commuting requirements.,negative,True,True,,1qwaz9i,ITCareerQuestions,Got an offer for IT technician position!,123,https://reddit.com/r/ITCareerQuestions/comments/1qwaz9i/got_an_offer_for_it_technician_position/,2026-02-05,True,
job_search,IT,,1.0,IT,"['limited interviews', 'high competition', 'importance of networking', 'introverted field']","Building relationships and networking is crucial in the job market, especially in IT where connections can lead to opportunities.",I got the position despite it being a massive leap career wise.,positive,True,False,,1nczs99,ITCareerQuestions,"The only way to get a job right now is to know someone in the company, the importance of social skills is undeniable.",118,https://reddit.com/r/ITCareerQuestions/comments/1nczs99/the_only_way_to_get_a_job_right_now_is_to_know/,2025-09-10,True,
career_switch,system administrator,cloud computing,3.0,IT,"['not doing real admin work', 'transition of company', 'offered non-IT role', 'saturated entry level market', 'lack of hands-on experience']",The poster is seeking advice on whether to pursue a master's in cloud computing or focus on obtaining certifications and starting from a help desk position.,The poster accepted a non-IT role but regrets not pursuing certifications or job searching sooner.,negative,True,False,,1ko5ffs,ITCareerQuestions,"Got too comfortable at my current job, and now it’s come back to bite me.",115,https://reddit.com/r/ITCareerQuestions/comments/1ko5ffs/got_too_comfortable_at_my_current_job_and_now_its/,2025-05-16,True,
job_search,help desk,,,IT,"['limited interviews', 'long job search duration']","The user sought resume advice and overhauled their resume based on feedback, which helped them secure a job.",The user landed their first job in IT after a long search.,positive,True,True,remote,1kmgc9h,ITCareerQuestions,Landed First Job In IT!!!,116,https://reddit.com/r/ITCareerQuestions/comments/1kmgc9h/landed_first_job_in_it/,2025-05-14,True,
job_search,helpdesk,,,IT,"['job market sucks', 'applied to hundreds of jobs', 'feeling stuck']",The poster is seeking tips on navigating the current job market after facing rejection in the interview process.,They were informed they were moving in a different direction after the second round of interviews.,negative,True,True,,1khni83,ITCareerQuestions,Feeling defeated- i know the job market sucks right now but DAMN!,111,https://reddit.com/r/ITCareerQuestions/comments/1khni83/feeling_defeated_i_know_the_job_market_sucks/,2025-05-08,False,
